{
"Record_ID":  1,
"Provider_ID":  "alphanumeric",
"Provider_Name":  "alphanumeric",
"Provider_Address":  "alphanumeric",
"Provider_Address":  "alphanumeric",
"Provider_City":  "alphanumeric",
"Provider_Zip":  1,
"Provider_State":  "alpha",
"Customer_First_Name":  "alpha",
"Customer_Middle_Init":  "alpha",
"Customer_Last_Name":  "alpha",
"Customer_SSN":  1,
"Customer_Name":  1,
"Customer_Address":  "alphanumeric",
"Customer_Address":  "alphanumeric",
"Customer_City":  "alphanumeric",
"Customer_Zip":  1,
"Customer_State":  "alpha ",
"Customer_Phone":  "xxx-xxx-xxxx",
"Customer_Email":  "email" ,
"Invoice_Amount":  "currency",
"Invoice_Date":  "date",
"Payment_Due_Date":  "date",
"Payment_Received":  "alpha",
"Payment_Received_Date":  "date",
"Balance_Due":  "currency"
}
